<?xml version="1.0" encoding="UTF-8"?>
<!-- Document created with online XML Editor http://xmlgrid.net 2020/04/07 20:21:35  -->
   <orders xmlns:xsi="http://www.w3.org/2001/XMLSchema-instance" xsi:noNamespaceSchemaLocation="file://test.xsd">
         <order name="test attribute">
               <bananas>1</bananas>
               <apples>1</apples>
               <strawberries>2.7182818284</strawberries>
               <price>2.7182818284</price>
               <tax>2.7182818284</tax>
         </order>
         <order name="test attribute">
               <bananas>1</bananas>
               <apples>1</apples>
               <strawberries>2.7182818284</strawberries>
               <price>2.7182818284</price>
               <tax>2.7182818284</tax>
         </order>
         <order name="test attribute">
               <bananas>1</bananas>
               <apples>1</apples>
               <strawberries>2.7182818284</strawberries>
               <price>2.7182818284</price>
               <tax>2.7182818284</tax>
         </order>
         <order name="test attribute">
               <bananas>1</bananas>
               <apples>1</apples>
               <strawberries>2.7182818284</strawberries>
               <price>2.7182818284</price>
               <tax>2.7182818284</tax>
         </order>
         <order name="test attribute">
               <bananas>1</bananas>
               <apples>1</apples>
               <strawberries>2.7182818284</strawberries>
               <price>2.7182818284</price>
               <tax>2.7182818284</tax>
         </order>
         <order name="test attribute">
               <bananas>1</bananas>
               <apples>1</apples>
               <strawberries>2.7182818284</strawberries>
               <price>2.7182818284</price>
               <tax>2.7182818284</tax>
         </order>
         <order name="test attribute">
               <bananas>1</bananas>
               <apples>1</apples>
               <strawberries>2.7182818284</strawberries>
               <price>2.7182818284</price>
               <tax>2.7182818284</tax>
         </order>
 </orders>